{
  "version": "1.0.0",
  "generated_at": "2026-10-10T11:53:10.455Z",
  "surfaces": [
    "README.md",
    "JUDGES.md",
    "design_documents/submission_description.md",
    "shots/showcase/captions.json",
    "src/copy/**/*"
  ],
  "claims": [
    {
      "id": "C-01",
      "match": "20 actions",
      "text": "The product registers 20 actions in six groups, plus the kit's capability listing.",
      "kind": "number",
      "source": {
        "type": "artifact",
        "path": "design_documents/showcase-facts.json",
        "pointer": "/actions",
        "format": "{v} actions"
      },
      "ceiling": "Counts the typed actions this product registers; the capability listing the kit adds is not counted.",
      "status": "verified",
      "verified_at": "2026-10-10T13:40:03.246Z"
    },
    {
      "id": "C-02",
      "match": "60 tests",
      "text": "The entry defines 60 tests across the browser suite.",
      "kind": "number",
      "source": {
        "type": "artifact",
        "path": "design_documents/showcase-facts.json",
        "pointer": "/e2eTests",
        "format": "{v} tests"
      },
      "ceiling": "Counts the browser tests that are defined; one is skipped in a run that has no Amazon Bedrock route.",
      "status": "verified",
      "verified_at": "2026-10-10T13:40:03.248Z"
    },
    {
      "id": "C-03",
      "match": "34.2 s",
      "text": "Treatment runs cost 34.2 s per try.",
      "kind": "number",
      "source": {
        "type": "artifact",
        "path": "evals/report.json",
        "pointer": "/treatment/wall_s_per_run",
        "format": "{v:1} s"
      },
      "ceiling": "Measured on the frozen evaluation tasks with the recorded model; per-try wall time on those tasks only.",
      "status": "verified",
      "verified_at": "2026-10-10T13:40:03.248Z"
    },
    {
      "id": "C-04",
      "match": "35.0%",
      "text": "Control runs succeed 35.0% of the time.",
      "kind": "number",
      "source": {
        "type": "artifact",
        "path": "evals/report.json",
        "pointer": "/control/pass_rate",
        "format": "{v:1}%"
      },
      "ceiling": "Measured on the frozen evaluation tasks with the recorded model; control-arm success on those tasks only.",
      "status": "verified",
      "verified_at": "2026-10-10T13:40:03.248Z"
    },
    {
      "id": "C-05",
      "match": "44527.3 tokens",
      "text": "Treatment runs spend 44527.3 tokens per try.",
      "kind": "number",
      "source": {
        "type": "artifact",
        "path": "evals/report.json",
        "pointer": "/treatment/tokens_per_run",
        "format": "{v:1} tokens"
      },
      "ceiling": "Measured on the frozen evaluation tasks with the recorded model; token spend on those tasks only.",
      "status": "verified",
      "verified_at": "2026-10-10T13:40:03.249Z"
    },
    {
      "id": "C-06",
      "match": "95.0%",
      "text": "Treatment runs succeed 95.0% of the time.",
      "kind": "number",
      "source": {
        "type": "artifact",
        "path": "evals/report.json",
        "pointer": "/treatment/pass_rate",
        "format": "{v:1}%"
      },
      "ceiling": "Measured on the frozen evaluation tasks with the recorded model; treatment-arm success on those tasks only.",
      "status": "verified",
      "verified_at": "2026-10-10T13:40:03.249Z"
    },
    {
      "id": "C-07",
      "match": "only",
      "text": "this shows success on those tasks only",
      "kind": "superlative",
      "source": {
        "type": "artifact",
        "path": "evals/report.json",
        "contains": "those tasks only"
      },
      "ceiling": "Quotes the measured block's own scope sentence from the evaluation report.",
      "status": "verified",
      "verified_at": "2026-10-10T13:40:03.249Z"
    }
  ]
}
